<?xml version="1.0" encoding="UTF-8"?>
<!DOCTYPE mets SYSTEM "file:/Users/jgp/dl/projects/ACO/dev/aco-mets/examples/one-ie-to-many-source-parent_mets.dtd">
<mets xmlns="http://www.loc.gov/METS/" xmlns:xlink="http://www.w3.org/1999/xlink" xmlns:xsi="http://www.w3.org/2001/XMLSchema-instance"
    xsi:schemaLocation="http://www.loc.gov/METS/ http://www.loc.gov/standards/mets/version191/mets.xsd http://www.loc.gov/mods/v3 http://www.loc.gov/standards/mods/mods.xsd"
    ID="mets" LABEL="" OBJID="" PROFILE="" xmlns:mods="http://www.loc.gov/mods/v3" TYPE="">
    <dmdSec ID="dmd-0000001"><!-- point to a MARCXML document --></dmdSec>
    <dmdSec ID="dmd-0000002"><!-- point to a different MARCXML document --></dmdSec>
    <dmdSec ID="dmd-arab">
        <mdWrap MDTYPE="MODS">
            <xmlData>
                <mods:recordInfo>
                    <mods:languageOfCataloging>
                        <mods:languageTerm>ara</mods:languageTerm>
                        <mods:scriptTerm type="code">Arab</mods:scriptTerm>
                    </mods:languageOfCataloging>
                </mods:recordInfo>
            </xmlData>
        </mdWrap>
    </dmdSec>
    <dmdSec ID="dmd-latin">
        <mdWrap MDTYPE="MODS">
            <xmlData>
                <mods:recordInfo>
                    <mods:languageOfCataloging>
                        <mods:languageTerm/>
                        <mods:scriptTerm/>
                    </mods:languageOfCataloging>
                </mods:recordInfo>
            </xmlData>
        </mdWrap>
    </dmdSec>
    <amdSec>
        <digiprovMD ID="foo">
            <mdRef LOCTYPE="URL" MDTYPE="OTHER" OTHERMDTYPE="CSV" CHECKSUM="" CHECKSUMTYPE="SHA-512" xlink:href="relative-path-to-environment-of-creation.csv"/>
        </digiprovMD>
    </amdSec>
    <fileSec>
        <fileGrp USE="CALIBRATION">
            <file ID="calibration-00000001" USE="target" CHECKSUM="some-awesome-sha1-hash-value" CHECKSUMTYPE="SHA-512" MIMETYPE="image/tiff">
                <FLocat LOCTYPE="URL" xlink:href="target_m.tif"/>
            </file>
        </fileGrp>
        <fileGrp USE="MASTER">
            <file ID="master-00000001" CHECKSUM="some-awesome-sha1-hash-value" CHECKSUMTYPE="SHA-512" MIMETYPE="image/tiff">
                <FLocat LOCTYPE="URL" xlink:href="master/12345678.tif"/>
            </file>
            <file ID="master-00000002" CHECKSUM="some-awesome-sha1-hash-value" CHECKSUMTYPE="SHA-512" MIMETYPE="image/tiff">
                <FLocat LOCTYPE="URL" xlink:href="master/12345679.tif"/>
            </file>
        </fileGrp>
        <fileGrp USE="DERIVATIVE_MAKER">
            <file ID="derivative_maker-00000001" CHECKSUM="some-awesome-sha1-hash-value" CHECKSUMTYPE="SHA-512" MIMETYPE="image/tiff">
                <FLocat LOCTYPE="URL" xlink:href="derivatives/12345678.tif"/>
            </file>
            <file ID="derivative_maker-00000002" CHECKSUM="some-awesome-sha1-hash-value" CHECKSUMTYPE="SHA-512" MIMETYPE="image/tiff">
                <FLocat LOCTYPE="URL" xlink:href="derivatives/12345679.tif"/>
            </file>
        </fileGrp>
    </fileSec>
    <structMap TYPE="ONE_TO_MANY_SOURCE">
        <div TYPE="SOURCE_ENTITIES" DMDID="dmd-0000001">
            <div TYPE="SOURCE_ENTITY" ID="bar">
                <mptr LOCTYPE="URL" xlink:href="parts/part.mets"/>
            </div>
            <div TYPE="SOURCE_ENTITY" ID="bar1">
                <mptr LOCTYPE="URL" xlink:href="parts/part1.mets"/>
            </div>
        </div>
    </structMap>
</mets>
